{
  "case_schema_version": "golden-case-0.1",
  "case_id": "GC-PUMP-004-UNKNOWN-CATEGORY",
  "case_status": "REVIEWED",
  "device_type": "centrifugal_pump",
  "profile_id": "pump_water",
  "business_spec_version": "0.1",
  "standard_pack_id": "gb19762_2025_water_v1",
  "standard_pack_version": "v1",
  "catalog_data_version": "2026.08.23",
  "ruleset_version": "pump_water-rules-0.1",
  "input": {
    "as_of": "2026-08-23",
    "input_basis": "STANDARD_BEP",
    "measurement_point": "BEP",
    "category": "其他（请备注说明）",
    "flow_m3h": "100",
    "head_m": "50",
    "rated_speed_rpm": "2900",
    "stages": "1",
    "pump_efficiency": "80",
    "unit_id_by_field": { "flow_m3h": "m3/h", "head_m": "m", "rated_speed_rpm": "rpm", "stages": "stage", "pump_efficiency": "%" }
  },
  "expected_status": "OUT_OF_STANDARD_SCOPE",
  "expected_actual_metrics": { "pump_efficiency_percent": { "value": "80", "unit_id": "%", "scale": 0 } },
  "expected_lookups": [
    {
      "table_id": "GB19762-T3",
      "data_ids": ["GB19762-T3-01", "GB19762-T3-02", "GB19762-T3-03", "GB19762-T3-04", "GB19762-T3-05", "GB19762-T3-06", "GB19762-T3-07", "GB19762-T3-08", "GB19762-T3-09", "GB19762-T3-10"],
      "matching": "category",
      "match_status": "CATEGORY_NOT_FOUND",
      "no_default_mapping": true,
      "no_interpolation": true
    }
  ],
  "expected_calculated_metrics": {
    "output_power_kw": { "value": "13.6250", "unit_id": "kW", "scale": 4 }
  },
  "expected_limits": {},
  "expected_conclusion": "不在范围",
  "expected_issue_codes": ["CATEGORY_NOT_IN_STANDARD_RANGE", "NO_DEFAULT_CATEGORY"],
  "expected_rule_ids": ["PUMP-WATER-CATEGORY-001"],
  "source_reference": [
    { "source_id": "src/equipeffi/resources/standards/pump.json", "artifact_kind": "REPOSITORY_FILE", "artifact_path": "src/equipeffi/resources/standards/pump.json", "artifact_sha256": "D1FAB8310AA5ADE7ACCCB379BD347F442D51202E0EE2EEF4CA6E34F5A2F3EA00", "clause_or_table": "GB 19762-2025 表3列出的泵型", "pages": ["9-10"], "stable_data_ids": ["GB19762-T3-01", "GB19762-T3-02", "GB19762-T3-03", "GB19762-T3-04", "GB19762-T3-05", "GB19762-T3-06", "GB19762-T3-07", "GB19762-T3-08", "GB19762-T3-09", "GB19762-T3-10"], "evidence_role": "CANONICAL_PACK" },
    { "source_id": "GB 19762-2025", "artifact_kind": "EXTERNAL_FILE", "artifact_path": "G:/标准  规范/02_能耗限额_终端产品/用能设备/重点设备能效标准/6 7. GB 19762-2025 离心泵能效限定值及能效等级.pdf", "artifact_sha256": "7F515D8B9D6B4D2AB97FFA7BECB78520BA0579CFBD6D5ECA10C7E7CC77895FEC", "clause_or_table": "表3适用泵型限制", "pages": ["9-10"], "stable_data_ids": ["GB19762-T3-01", "GB19762-T3-02", "GB19762-T3-03", "GB19762-T3-04", "GB19762-T3-05", "GB19762-T3-06", "GB19762-T3-07", "GB19762-T3-08", "GB19762-T3-09", "GB19762-T3-10"], "evidence_role": "STANDARD" },
    { "source_id": "src/equipeffi/domain/evaluation/evaluators/pump.py", "artifact_kind": "REPOSITORY_FILE", "artifact_path": "src/equipeffi/domain/evaluation/evaluators/pump.py", "artifact_sha256": "66F84899DA5FE411340311075346D75216F1335577669CF3CC2C16F1129611EF", "clause_or_table": "unknown category guard", "evidence_role": "CURRENT_IMPLEMENTATION" }
  ],
  "review_status": "REVIEWED",
  "review_metadata": {
    "reviewed_at": "2026-09-22",
    "reviewer": "Phase 1 technical evidence review",
    "review_owner": "Solution Review designated standards owner (REQUIRED_INPUT)",
    "approval_basis": ["标准表没有‘其他’行，且当前实现明确禁止默认单级单吸", "独立复核确认不生成虚假的比转速和等级"],
    "known_limits": ["若标准所有者对‘其他’类别有额外适用规则，必须以新证据和新 Golden Case 修订", "标准 PDF 原件不在仓库"]
  }
}
