{
  "case_schema_version": "golden-case-0.1",
  "case_id": "GC-PUMP-002-OUTSIDE",
  "case_status": "REVIEWED",
  "device_type": "centrifugal_pump",
  "profile_id": "pump_water",
  "business_spec_version": "0.1",
  "standard_pack_id": "gb19762_2025_water_v1",
  "standard_pack_version": "v1",
  "catalog_data_version": "2026.08.23",
  "ruleset_version": "pump_water-rules-0.1",
  "input": {
    "as_of": "2026-08-23",
    "input_basis": "STANDARD_BEP",
    "measurement_point": "BEP",
    "category": "单级单吸",
    "flow_m3h": "4.999",
    "head_m": "50",
    "rated_speed_rpm": "2900",
    "stages": "1",
    "pump_efficiency": "90",
    "unit_id_by_field": { "flow_m3h": "m3/h", "head_m": "m", "rated_speed_rpm": "rpm", "stages": "stage", "pump_efficiency": "%" }
  },
  "expected_status": "OUT_OF_STANDARD_SCOPE",
  "expected_actual_metrics": { "pump_efficiency_percent": { "value": "90", "unit_id": "%", "scale": 0 } },
  "expected_lookups": [
    { "table_id": "GB19762-T3", "data_ids": ["GB19762-T3-01", "GB19762-T3-02"], "matching": "category+flow_m3h", "match_status": "FLOW_RANGE_MISS", "no_interpolation": true }
  ],
  "expected_calculated_metrics": {
    "flow_effective_m3h": { "value": "4.999", "unit_id": "m3/h", "scale": 3 },
    "head_stage_m": { "value": "50", "unit_id": "m", "scale": 0 },
    "specific_speed": { "value": "20.977497456046", "unit_id": "unitless", "scale": 12, "rounding": "HALF_UP" },
    "output_power_kw": { "value": "0.681113750", "unit_id": "kW", "scale": 9 }
  },
  "expected_limits": {},
  "expected_conclusion": "不在范围",
  "expected_issue_codes": ["FLOW_RANGE_MISS"],
  "expected_rule_ids": ["PUMP-WATER-BOUNDARY-001", "PUMP-WATER-NO-INTERPOLATION-001"],
  "source_reference": [
    { "source_id": "src/equipeffi/resources/standards/pump.json", "artifact_kind": "REPOSITORY_FILE", "artifact_path": "src/equipeffi/resources/standards/pump.json", "artifact_sha256": "D1FAB8310AA5ADE7ACCCB379BD347F442D51202E0EE2EEF4CA6E34F5A2F3EA00", "clause_or_table": "GB 19762-2025 表3", "pages": ["9-10"], "stable_data_ids": ["GB19762-T3-01", "GB19762-T3-02"], "evidence_role": "CANONICAL_PACK" },
    { "source_id": "GB 19762-2025", "artifact_kind": "EXTERNAL_FILE", "artifact_path": "G:/标准  规范/02_能耗限额_终端产品/用能设备/重点设备能效标准/6 7. GB 19762-2025 离心泵能效限定值及能效等级.pdf", "artifact_sha256": "7F515D8B9D6B4D2AB97FFA7BECB78520BA0579CFBD6D5ECA10C7E7CC77895FEC", "clause_or_table": "表3：Q ≥ 5 的适用范围", "pages": ["9-10"], "stable_data_ids": ["GB19762-T3-01", "GB19762-T3-02"], "evidence_role": "STANDARD" }
  ],
  "review_status": "REVIEWED",
  "review_metadata": {
    "reviewed_at": "2026-09-22",
    "reviewer": "Phase 1 technical evidence review",
    "review_owner": "Solution Review designated standards owner (REQUIRED_INPUT)",
    "approval_basis": ["独立 Decimal 计算复核不外推并保留确定的派生指标", "标准行候选和未命中边界已记录"],
    "known_limits": ["标准 PDF 原件不在仓库；Solution Review 可要求外部标准复核"]
  }
}
